{
  "protocolVersion": "2.0",
  "eventId": "10000000-0000-4000-8000-000000000001",
  "sequence": 0,
  "sessionId": "20000000-0000-4000-8000-000000000001",
  "turnId": null,
  "type": "session.ready",
  "timestamp": "2026-07-17T08:00:00.000Z",
  "data": {
    "resumedAfter": 0,
    "gatewayTime": "2026-07-17T08:00:00.000Z"
  }
}
