{
  "protocolVersion": "2.0",
  "eventId": "10000000-0000-4000-8000-000000000004",
  "sequence": 3,
  "sessionId": "20000000-0000-4000-8000-000000000001",
  "turnId": "40000000-0000-4000-8000-000000000001",
  "type": "stt.final",
  "timestamp": "2026-07-17T08:00:03.000Z",
  "data": {
    "text": "Wie ist das Wetter?",
    "language": "de-DE"
  }
}
