{
  "protocolVersion": "2.0",
  "eventId": "10000000-0000-4000-8000-000000000015",
  "sequence": 5,
  "sessionId": "20000000-0000-4000-8000-000000000001",
  "turnId": "40000000-0000-4000-8000-000000000001",
  "type": "agent.text.final",
  "timestamp": "2026-07-17T08:00:05.000Z",
  "data": {
    "text": "Hallo! Wie kann ich helfen?"
  }
}
