{
  "protocolVersion": "2.0",
  "eventId": "99999999-9999-4999-8999-999999999999",
  "sequence": 42,
  "sessionId": "11111111-1111-4111-8111-111111111111",
  "turnId": "22222222-2222-4222-8222-222222222222",
  "type": "camera.captured",
  "timestamp": "2026-09-22T00:00:00Z",
  "data": {
    "artifactId": "88888888-8888-4888-8888-888888888888",
    "mimeType": "image/jpeg",
    "byteLength": 800,
    "sha256": "aaaaaaaaaaaaaaaaaaaaaaaaaaaaaaaaaaaaaaaaaaaaaaaaaaaaaaaaaaaaaaaa",
    "width": 640,
    "height": 480,
    "capturedAt": "2026-09-22T00:00:00Z"
  }
}
