{
  "protocolVersion": "2.0",
  "eventId": "10000000-0000-4000-8000-000000000016",
  "sequence": 6,
  "sessionId": "20000000-0000-4000-8000-000000000001",
  "turnId": "40000000-0000-4000-8000-000000000001",
  "type": "tts.ready",
  "timestamp": "2026-07-17T08:00:06.000Z",
  "data": {
    "artifacts": [
      {
        "artifactId": "50000000-0000-4000-8000-000000000001",
        "mimeType": "audio/mpeg",
        "byteLength": 48201,
        "sha256": "0123456789abcdef0123456789abcdef0123456789abcdef0123456789abcdef",
        "expiresAt": "2026-07-17T08:05:06.000Z"
      }
    ]
  }
}
